batch_id	title	summary_100	genre_tags	core_hook
1771638289712	脳内インプラント魔導師：思考加速で詠唱破棄	脳にチップを埋め込んだハッカーが異世界転生し、演算能力と魔力を同期させる「思考加速魔法」を開発。詠唱破棄と極超音速の魔法構築で無双するが、脳のオーバーヒート（知恵熱）と戦うことになる。	転生, サイバーパンク, 魔法術式, 無双	脳内チップのハッキング技術で魔法のプログラム詠唱をスキップ・最適化し、思考速度で最速の魔法を乱射する。
1771638289712	クライメート・エンジニアリング：天候制御装置を作れ	気象予報士が砂漠化の進む異世界で、魔法を使った人工降雨「天候制御タワー」を建設。自然環境をハックして緑を取り戻すが、気象兵器として利用を企む軍事国家と防衛戦を繰り広げる。	転生, 気象学, 開発, 防衛戦	神の領域である「天候」を風と水の複合魔法タワーで自在に操り、兵器利用を目論む国家から気象をコントロールして守る。
1771638289712	培養肉ハンター：魔物を殺さず肉を食う	魔物の乱獲で生態系が崩壊寸前の世界に転生した食品研究者が、魔物の細胞を増殖させる「培養肉プラント」を建設。殺生せずに無限の絶品ドラゴン肉等を生み出し、食肉業界と対立する。	転生, グルメ, バイオテクノロジー, 経営	細胞培養プラントを魔法で作ることで、希少な魔物を殺すことなく永遠に最高級の肉を量産する。
1771638289712	スマートコントラクト冒険者ギルド：報酬の未払いは許さない	ブロックチェーンエンジニアが信用ゼロの冒険者ギルドに、自動で報酬が決済される魔法契約書（スマートコントラクト）を導入。不正やピンハネをシステム的に撲滅し、悪徳ギルドマスターと戦う。	転生, IT, 経営, 痛快	依頼達成と同時に強制的に報酬が送金されるスマートコントラクトギルドを作り、冒険者の未払い問題を根絶する。
1771638289712	リモート・ゴーレム操作：安全圏から魔王討伐	引きこもりゲーマーが、自宅から魔力通信で遠隔操作できる「アバター・ゴーレム」を開発。安全な自室から低遅延VRで最前線の戦場に参加し、圧倒的プレイヤースキルで無双の英雄となる。	転生, VR, コメディ, ロボット	パジャマ姿のまま自宅から一歩も出ず、遠隔操作ゴーレムで魔王を物理的に討伐する。
1771638289712	異世界YouTuber：ダンジョン攻略を生配信	動画配信者が使い魔の目（カメラ）を使ってダンジョン攻略を街角に生配信。スリルと実況で高評価とおひねりを稼ぐが、視聴率狙いで過激な罠に挑み炎上や命の危機にも直面する。	転生, 配信, エンタメ, コメディ	異世界初のライブストリーミング環境を作り上げ、ダンジョンアタックをエンタメコンテンツとして消費させる。
1771638289712	量子テレポーテーション便：物流革命	物理学者が地点を量子もつれで繋ぐ「転送ゲート」を開発し、瞬時の物質移動による物流革命を起こす。世界経済を激変させるが、関税収入が減った国から指名手配されゲートで逃避行する。	転生, SF, 物流, 逃亡劇	量子テレポーテーションを魔法陣で再現し、距離の概念を消滅させて関所を通らない完璧な密輸・物流網を敷く。
1771638289712	異世界ソーシャルレンディング：夢への投資	金融マンが貧富の差が激しい異世界で、魔法掲示板を通じた「クラウドファンディング」システムを構築。平民の小さな事業計画に小口資金を集め、信用とパトロンの力で新産業を続々生み出す。	転生, 金融, 内政, ヒューマンドラマ	貴族や銀行に頼らず、大衆から少額ずつ資金を調達するクラウドファンディングで平民の夢を叶えまくる。
1771638289712	バイオハッカー・エルフ：遺伝子操作で最強ボディ	遺伝子工学者が魔力の低いエルフに生まれ変わり、植物や魔物の優れたDNAを自らの体に組み込む「バイオハック」を実行。掟を破りながらも光合成やドラゴンの皮膚を持つ最強の新人類アバターとなる。	転生, エルフ, バイオテクノロジー, 無双	エルフの肉体に魔獣の遺伝子を次々とパッチ当て（バイオハック）し、物理的にも魔法的にも最強のキメラ・エルフとなる。
1771638289712	異世界マッチングアプリ：運命の相手はアルゴリズムで	婚活アドバイザーが魔法相性や家柄データを分析する「運命のマッチング魔法」を開発。政略結婚至上主義の世界にデータドリブンな自由恋愛をもたらし、旧弊な貴族社会の妨害を恋愛の力で打破する。	転生, 恋愛, IT, ヒューマンドラマ	身分や種族にとらわれず、性格と魔力相性のアルゴリズムで異世界最高のマッチングアプリを運用する。
1771638289712	異世界UberEats：空飛ぶ箒でデリバリー	フードデリバリー配達員が飛行魔法使いたちを組織し、異世界初の「料理デリバリーギルド」を創設。保温魔法バッグを使い人気店の味を各家庭に届け、飲食経済を爆発させるお仕事コメディ。	転生, お仕事, コメディ, 経営	空飛ぶ箒による圧倒的な機動力と保温魔法を組み合わせた超音速フードデリバリーで胃袋を満たす。
1771638289712	異世界Airbnb：空き部屋を宿に	旅行代理店員が宿不足の異世界で、一般家庭の空き部屋を旅行者に貸す「民泊システム」を構築。レビューと保険制度でトラブルを防ぎつつ、異世界ホームステイという新たな観光文化を根付かせる。	転生, 観光業, 経営, スローライフ	巨大なホテルではなく、一般の空き部屋を信用スコア（レビュー）付きでシェアする異世界民泊ビジネスを展開する。
1771638289712	異世界エステティシャン：魔法でアンチエイジング	美容家が回復魔法と錬金術を応用し、シミ消しの光魔法や重力リフトアップを行う「魔法エステ」を開業。過酷な環境で荒れた肌を美しく変え、トップカリスマとして美容界に君臨する。	転生, 美容, お仕事, スローライフ	ダメージ回復用の魔法をアンチエイジング美容に極振り・最適化し、女性たちの自己肯定感を爆上げする。
1771638289712	異世界コンサルタント：魔王軍の経営再建	経営コンサルが資金難と人材不足で崩壊寸前の魔王軍に再建策を提示。人間界との貿易やダンジョン観光地化で黒字化を達成し、既得権益のために攻めてくる勇者を経済と交渉術で懐柔する。	転生, 経営, ポリティカル, コメディ	無能な組織だった魔王軍に現代の経営戦略（多角化・福利厚生）を持ち込み、人間と戦争するより儲かる体質へ変革する。
1771638289712	異世界プログラマー：魔法をコードで記述せよ	システムエンジニアが感覚頼りの魔法を論理構造で解析し、プログラムのように書ける「魔導言語（スクリプト）」を開発。ループや条件分岐で誰でも使える安定した魔法文明を築く。	転生, IT, 魔法研究, 開発	呪文ではなくソースコードを記述して魔法をコンパイル（発動）し、魔力のない素人でも魔法を使えるようにする。
1771638289712	異世界ロジスティクス：転移門で世界を繋ぐ	倉庫番が魔力石を使った「簡易転移ゲート」を発明し、誰もが使える倉庫間転移ネットワークを構築。世界規模の超高速ロジスティクスを完成させ、関税や国境を気にする国家の規制と戦う。	転生, 物流, 内政, お仕事	特権階級の転移魔法をチープな魔法道具に落とし込み、Amazonのような即日配達の巨大ゲート網を作る。
1771638289712	異世界インフルエンサーマーケティング：商品をバズらせろ	広告マンが口コミを意図的に作り出すため、歌姫や英雄を起用した「魔法インフルエンサーマーケティング」を開始。宣伝不足の商品を瞬く間にバズらせるが、ステマ炎上にも見舞われる。	転生, 広告, 経営, コメディ	有名冒険者やアイドルに金銭を払って商品をステマ（宣伝）させ、口コミの意図的バズで莫大な利益を生む。
1771638289712	異世界eスポーツ：魔法バトルを競技化	プロゲーマーが野蛮な殺し合いの魔法戦を、ダメージ無効化結界の中で行う「マジック・アリーナ（eスポーツ）」へと昇華させる。高額賞金とスポンサー集客で熱狂を生み戦争をなくす。	転生, eスポーツ, 興行, 平和	血生臭い対人戦を、死なない結界の中での洗練されたスポーツ（興行）に変え、莫大な大会ビジネスを立ち上げる。
1771638289712	異世界シェアハウス：種族を超えた共同生活	孤独な老人が巨大な屋敷を改装し、エルフから獣人まで多様な種族が一つ屋根の下で暮らすシェアハウスを運営。文化の摩擦から生じるトラブルを乗り越え、種族融和の象徴となる。	転生, スローライフ, ヒューマンドラマ, 異種族交流	偏見まみれの多種族たちを同じシェアハウスに強制入居させ、共同生活を通して差別をなくしていく。
1771638289712	異世界ドローンレーサー：空のF1	ラジコン好きが魔導エンジン搭載の「小型ドローン」を作り上げ、貴族の専売特許であるドラゴンレースに乱入。驚異の加速力で巨大ドランゴンを翻弄し、新たなスカイスポーツの道を拓く。	転生, スポーツ, メカニック, 熱血	魔法で作られた超高速のレース用ドローンで、大型のドラゴン乗りたちを音速で置き去りにして空の最速を決める。
1771638289712	異世界DIY：魔法でリフォーム	大工見習いが魔法を使って木材加工やペンキ塗りをこなし、古い住環境を明るく快適なキッチンやトイレへと劇的リフォーム。DIYの魔法で、陰気な異世界人の生活を一変させる。	転生, 建築, DIY, スローライフ	現代日本の快適な住宅間取りや収納ノウハウを、魔法大工スキルで一般家庭にインストールしていく。
1771638289712	異世界お片付けコンサルタント：心も整理整頓	片付けアドバイザーが「ときめき」を基準にした取捨選択の魔法で、ゴミ屋敷に住む異世界人たちの部屋と過去のトラウマを整理整頓する。不要なものを捨てることで人々の悩みを解決していく。	転生, お仕事, 心理学, スローライフ	断捨離の概念がない異世界で「物理的な物の処分」と「精神的なトラウマの浄化」を同時に行うお片付けビジネス。
1771638289712	異世界サウナ：整う魔法	サウナ好きの男が火と水魔法で本格サウナと水風呂を建設。入浴習慣すらない異世界人を「整う」快感の虜にし、疲労回復や美肌効果で絶大な癒やしと熱狂のサウナブームを巻き起こす。	転生, サウナ, スローライフ, グルメ	野蛮で不潔な異世界に本場フィンランド式の高温サウナと水風呂を持ち込み、強制的に「整わせる」。
1771638289712	異世界キャンプ：自然と生きる	ソロキャンパーが魔物の巣窟と恐れられる森の中に結界魔法で安全地帯（サイト）を作り、優雅な焚き火やコーヒーのキャンプを満喫。その姿が人々に自然との共生という生き方を教える。	転生, アウトドア, スローライフ, グルメ	絶対危険領域である魔の森に結界を張って安全圏を確保し、一人静かに最高のキャンプ飯と外気浴を楽しむ。
1771638289712	異世界コーヒーバリスタ：安らぎの一杯	喫茶店マスターが苦い薬草茶しかない世界で、異世界の木の実から究極の一杯（コーヒー）を焙煎。香り高く深い味わいのコーヒーが、戦いや魔法研究に疲れた英雄たちの心を癒やす場を作る。	転生, グルメ, カフェ, スローライフ	異世界の未知の果実を現代の焙煎技術とドリップで淹れ、多忙な戦士たちをカフェインと香りで骨抜きにする。
1771638289712	異世界パン屋：酵母魔法でふっくら	パン職人が硬い黒パンしかない世界で、酵母菌と対話する魔法を使ってフワフワの白パンやクロワッサンを焼く。焼きたての香りと甘みが街全体を多幸感で包み込む癒やしのお仕事ファンタジー。	転生, グルメ, 農業, スローライフ	魔法で酵母の発酵状態を完全にコントロールし、異世界には存在しない圧倒的に美味い「ふわふわのパン」を量産する。
1771638289712	異世界探偵：魔法の痕跡を追え	私立探偵が魔力残滓を視る瞳と現代の推理力で、完全犯罪と思われた魔法事件の裏の真実を暴く。密室や行方不明事件に隠された人々の悲しい動機を紐解き、心を救済するハードボイルドミステリー。	転生, ミステリー, 推理, ドラマ	証拠が残らない魔法犯罪を、「魔力残滓」という指紋やDNA情報に相当する痕跡から論理的に解決する。
1771638289712	異世界翻訳家：言葉の壁を超えて	言語学者がすべての種族の言葉（オーク語からドラゴンの咆哮まで）を翻訳する魔導具を開発。言葉が通じないことによる無意味な争いを対話で終わらせ、異世界に平和をもたらす歩み寄りの物語。	転生, 言語学, 外交, 平和	あらゆる異種族の言語パターンを瞬時に翻訳できるシステムを作り、武力ではなく対話による外交で戦争を回避する。
1771638289712	異世界図書館司書：知識を守る	図書館員が知識を独占する特権階級に反旗をひるがえし、民衆に文字を教え誰でも利用できる最強の「公共図書館」を設立。知識の共有を通して農業や工業レベルを跳ね上げ、世界を豊かに導く。	転生, 図書館, 教育, 内政	貴族が秘匿している書物を勝手にコピーして大衆図書館化し、情報化社会の力で下剋上を起こす。
1771638289712	異世界数学者：数式で魔法を解明	数学者が感覚的で頭打ちになっていた魔法現象を美しい「数学的証明」を用いて解析・再構築。より強力で効率的な魔法理論が魔導工学に革命を起こし、無限の発明を生み出す原動力となる。	転生, 学問, 魔法研究, テクノロジー	詠唱や気合いといったオカルト魔法を微積分や方程式で論理的に証明し直すことで、神レベルの超魔法を安定出力する。
1771638289712	異世界心理カウンセラー：勇者のメンタルケア	心理カウンセラーが、重圧で病んだ勇者や兵士たちのトラウマに寄り添うメンタルケアサロンを開設。魔法の薬ではなく対話で心を通わせ、真の健康と強さを取り戻させる医療ドラマ。	転生, 医療, カウンセリング, ドラマ	魔王を倒すプレッシャーで壊れかけた勇者を、フロイトやアドラー心理学の対話アプローチで社会復帰させる。
1771638289712	異世界保育士：魔王の子供を育てる	保育士が魔族を根絶絶やしにしようとする世界で、親を殺された魔族の孤児たちを引き取る孤児院（保育園）を開設。深い愛情で彼らの憎しみを解きわだかまりを越えた共存の未来を育てる。	転生, 保育, ヒューマンドラマ, 異種族交流	迫害される最強最悪の魔族チビッ子たちを、現代のプロ保育士スキルで優しく（時に厳しく）手懐けて立派に育てる。
1771638289712	異世界介護士：老後も楽しく	介護士が長い寿命を持て余すエルフやドワーフの老人たちに、デイサービスでゲートボールや編み物などのレクリエーションを提供。「終活」ならぬ楽しい余生で活力を与え尊敬を集める。	転生, 医療福祉, スローライフ, コメディ	不死に近い寿命で無気力になったハイエルフのお爺ちゃん達を、手押し車やカラオケなどの高齢者レクで熱狂させる。
1771638289712	異世界獣医師：幻獣を救え	獣医師が殺処分される傷ついた魔獣たちを治癒魔法と外科手術のコンボで救済する獣医クリニックを開院。恩返しに来るペガサスや森の神獣たちとの絆を描く心温まる動物医療ファンタジー。	転生, 医療, 動物, ヒューマンドラマ	回復魔法の効かない特殊な魔獣の病や怪我を、現代の解剖学とメスを使った獣医外科手術で治癒する。
1771638289712	異世界弁護士：冤罪を晴らす	弁護士が王侯貴族の都合で冤罪をかけられる平民たちを救うべく、証拠集めと法廷の論理構築で裁判に挑む。「法の下の平等」を勝ち取り、絶対権力者の不正を論破する逆転法廷劇。	転生, 法律, 裁判, 痛快	武力や権力が支配する異世界のインチキ裁判において、物証と緻密な論理的尋問で検察官（貴族）を完全論破する。
1771638289712	異世界ジャーナリスト：真実を報道せよ	新聞記者が情報統制された王国の腐敗を暴くため、魔法の印刷機でゲリラ的に「壁新聞」を発行。隠蔽された戦争の真実や民衆の苦しみを報道し、ペンの力で独裁国家を転覆へと導く。	転生, ルポルタージュ, 革命, 内政	魔法ネットワークと活版印刷を駆使し、フェイクニュースが蔓延する国家の闇を特大スクープとしてすっぱ抜く。
1771638289712	異世界政治家：民主主義を導入せよ	政治家が暴君の独裁政治に苦しむ国家に、議会制民主主義と選挙システムを無血で導入。はじめは戸惑う民衆に主権を教え啓蒙し、自分たちで未来を選ぶ喜びから新しい国を建国する。	転生, 政治, 革命, 内政	王政・貴族制の異世界に「選挙・多数決・議会」の概念を持ち込み、国民の扇動と同意で平和裏に革命を果たす。
1771638289712	異世界外交官：戦争を回避せよ	外交官が些細な理由で開戦する野蛮な異世界国家群の間を飛び回り、粘り強い交渉で利益を調整条約締結にこぎつける。たった一つの言葉やハッタリで数万の兵力の激突を未然に防ぐ外交サスペンス。	転生, 外交, 政治, 頭脳戦	剣も魔法も使わず、卓上の交渉術と条約の抜け穴探しだけで大国同士の世界大戦を寸前で回避し続ける。
1771638289712	異世界考古学者：古代の叡智を発掘せよ	考古学者が誰も見向きもしない古代の遺跡を地道に発掘・解明。失われた魔法技術や文明滅亡の理由（教訓）を掘り起こし、現代の兵器開発に警鐘を鳴らしながら世界の隠された真実へ迫る。	転生, 考古学, 冒険, ロマン	ダンジョンを宝探しで荒らすのではなく「地層・土器年代測定」的手法で解析し、滅びた古代魔法帝国の謎を解く。
1771638289712	異世界民俗学者：伝承を記録せよ	民俗学者が失われつつある異郷の口伝や伝説を採集するために世界を旅する。忘れ去られた精霊の知恵や神々のルーツを記録から紐解き、民族のアイデンティティを取り戻す地味だが響く冒険譚。	転生, 民俗学, 探索, スローライフ	魔王討伐ではなく、過疎の村を訪ね歩いて「ババサマの昔話」をフィールドワーク採集し異世界の歴史を編纂する。
1771638289712	異世界地質学者：資源を探せ	地質学者が地層や岩石の成分調査を行い、枯渇する水脈や未知の鉱脈を次々と看破。争いの絶えない国々に新たな資源をもたらし、土地の奪い合いから脱却させる資源開発・地学内政モノ。	転生, 地学, 発見, 内政	魔法の探知機よりも正確な「地層や断層の読み取り」で、大地に眠るダイヤモンド鉱脈やレアメタルをピンポイントで掘り当てる。
1771638289712	異世界天文学者：星を読め	天文学者が運命の星占い（迷信）しか信じない世界で、自作の望遠鏡を用いて天体の軌道や宇宙の広がりを科学的に観測。地動説や正確な暦を普及させ、人々の宗教的世界観を根底からひっくり返す。	転生, 天文学, 発見, ロマン	神学と密接な異世界の占星術を、物理と数学による「天体観測と軌道計算」で完全否定し科学の光をかかげる。
1771638289712	異世界生物学者：生態系を守れ	生物学者が乱獲による絶滅の危機を救うため異世界の森林・河川生態系を徹底調査。食物連鎖のバランス保全活動を行い、自然との共存共栄を目指し密猟者や開発業者と熾烈な争いを繰り広げる。	転生, 生物学, 環境保護, 冒険	魔獣を倒すのではなく「食物連鎖のトップ捕食者」として扱い、魔法世界の乱れたバイオーム（生態系）を回復させる。
1771638289712	異世界化学者：新素材を作れ	化学者がオカルト扱いされている「錬金術」を完全な化学反応式で実証。魔法による加熱や冷却を利用してチタン合金レベルの新素材や特効薬を理論的に合成し、科学（化学）の力で人々の生活を変える。	転生, 化学, 錬金術, 発明	曖昧な大釜の錬金術をすべて「モル計算と化学結合法則」で管理し、異世界には存在しないプラスチックや近代合金を生成する。
1771638289712	異世界物理学者：動力革命	物理学者が人力と魔獣頼みの異世界に、熱力学第二法則等の知識を用いて蒸気機関（魔道エンジン）やモーターを導入。大規模な工場や鉄道を生み出し、瞬く間に近代化のパラダイムシフトを引き起こす。	転生, 物理学, 開発, 内政	魔法をただの火や風の現象として終わらせず、「タービンを回して電力（動力）に変える仕組み」を発明し産業革命を起こす。
1771638289712	異世界建築家：摩天楼を建てろ	建築家が土地不足の平屋世界で、魔法による鉄筋コンクリート補強を駆使した自重を支える高層ビル（摩天楼）を次々建設。立体的な空中都市開発で過密問題を解消し、次世代の都市プランニングを行う。	転生, 建築, 内政, IT	土魔法の力業ではなく、現代の構造力学計算に基づいた完璧な耐震高層ビルを数ヶ月で天高く建設する。
1771638289712	異世界芸術家：美で心を救え	画家がその日暮らしで芸術の概念すらない殺伐とした世界で、街の壁に色鮮やかな絵（ストリートアート）を投下。色彩の魔法で人々に明日への希望と活力を与え、心から世界を豊かに塗り替えていく。	転生, アート, ヒューマンドラマ, スローライフ	貧民街の壁や道端にスプレー（魔法顔料）でバンクシー的なグラフィティを描き、絶望した人々の心をアートで救う。
1771638289712	異世界音楽家：音で世界を一つに	音楽家が言葉の通じない対立種族の間でオーケストラを結成。美しいハーモニーの音楽演奏によって言葉の壁を超え、敵対する勢力同士も武器を置き聴き入る奇跡のコンサートで平和をもたらす。	転生, 音楽, 芸術, 平和	ドワーフの太鼓とエルフのハープで構成された多種族交響楽団を作り、音楽という共通言語で戦争を止めさせる。
1771638289712	異世界哲学者：生きる意味を問え	哲学者が神の啓示だけが絶対とされる世界に降り立ち、広場で「正義とは何か、幸福とは何か」を民衆と対話（ソクラテスメソッド）。自分の頭で考えることを教え、宗教的束縛から人々の精神を解放する。	転生, 哲学, 対話, 宗教	魔法の威力ではなく「存在と倫理学」による問いかけで、思考停止に陥った異世界人の洗脳を哲学で解く。
